Ticket ID,Summary,Current Status,Date Entered Status,Days in Current Status,Problem to Address,Team,Roadmap
PLD-117,Tracking section start and completion in React Front End architecture,Assessing Viability & Value,2026-03-23,0,Frontend Vision,Unassigned,Unassigned
PLD-116,Fully Independent Ephemeral Environments,To Do Ideas,2026-03-09,13,I want a better developer experience,Vivace,Developer Experience
PLD-115,Visualize Rater's DSL tables via Quid UI,Idea Backlog,2026-03-03,19,Quoting,Mind The Gap,Insurance Product Management
PLD-114,Reactified product application performance,Design/Solution Validation,2026-03-10,13,I need the journey framework to support developing straightforward and personalised journeys,Unassigned,Journey 2.0
PLD-113,Streamlined rater local testing,Design/Solution Validation,2026-03-16,6,I want a better developer experience,Vivace,Developer Experience
PLD-112,Should we and How can we shift left Contract Validation?,Assessing Viability & Value,2026-02-27,24,Frontend Vision,Unassigned,Frontend Architecture
PLD-111,Synchronous Quoting won't scale with external carriers.,Idea Backlog,2026-02-23,27,Quoting,Mind The Gap,Insurance Product Management
PLD-110,Async quoteset generation,To Do Ideas,2026-02-28,23,Quoting,Mind The Gap,Insurance Product Management
PLD-108,Smoke test harness for Rater,Idea Backlog,2026-02-12,38,I want a better developer experience,Vivace,Developer Experience
PLD-100,Simulation Runner/Testing,Idea Design & Solutioning,2026-03-16,7,Quoting,Unassigned,Insurance Product Management
PLD-99,Governance & Publishing Workflow,Design/Solution Validation,2026-03-11,11,Quoting,Mind The Gap,Insurance Product Management
PLD-98,Filter Rules (Hiscox Business),Idea Backlog,2026-02-17,33,Quoting,Mind The Gap,Insurance Product Management
PLD-96,Quid test harness,Idea Backlog,2026-01-26,55,I want a better developer experience,Vivace,Developer Experience
PLD-95,quid+risk_profiler co-dependency problem (i.e. merge the projects),Idea Backlog,2026-01-26,55,I want a better developer experience,Vivace,Developer Experience
PLD-94,can we use feature flagging for non-insurer-build work,Idea Backlog,2026-01-26,55,I want a better developer experience,Vivace,Developer Experience
PLD-93,DevContainers for consistent app environment locally,Idea Backlog,2026-02-16,34,I want a better developer experience,Vivace,Developer Experience
PLD-92,Inflight questions/sections reordering,Idea Backlog,2026-02-18,33,I need the journey framework to support developing straightforward and personalised journeys,Unassigned,Journey 2.0
PLD-91,Providing just in time questions / sections to FE product application,Design/Solution Validation,2026-03-10,13,I need the journey framework to support developing straightforward and personalised journeys,Unassigned,Journey 2.0
PLD-90,Interrupt product application,Idea Backlog,2026-02-18,33,I need the journey framework to support developing straightforward and personalised journeys,Unassigned,Journey 2.0
PLD-89,Securely resuming product application,Idea Backlog,2026-02-18,33,I need the journey framework to support developing straightforward and personalised journeys,Unassigned,Journey 2.0
PLD-88,Consistent questions / sections ordering / wording for each individual customer,Design/Solution Validation,2026-03-10,13,I need the journey framework to support developing straightforward and personalised journeys,Unassigned,Journey 2.0
PLD-85,How can we harden Quote Retrieval mechanism for Cross-Sell,Idea Backlog,2025-12-16,97,Quoting,Unassigned,Insurance Product Management
PLD-82,"for coco testing, use dockerised chopin master to generate policy to be renewed",Idea Backlog,2026-01-26,55,I want a better developer experience,Vivace,Developer Experience
PLD-81,use dotenv in coco,Idea Backlog,2025-12-11,102,I want a better developer experience,Unassigned,Developer Experience
PLD-78,knowledgebase/wiki/shared doc/chatbot for local dev troubleshooting,Idea Backlog,2026-01-26,55,I want a better developer experience,Vivace,Developer Experience
PLD-66,Federated Personalisation Decisioning with Centralised State (SO),Idea Backlog,2026-02-18,33,I need the journey framework to support developing straightforward and personalised journeys,Unassigned,Journey 2.0
PLD-63,"How can we gain a complete, end-to-end view of the multi-product customer journey?",Idea Backlog,2025-09-04,200,Unassigned,Unassigned,Sales Opportunity Framework
PLD-59,Can we have an unique sales opportunity id for the same customer until the sale is finalised,Idea Backlog,2025-08-26,209,I need the journey framework to support developing straightforward and personalised journeys,Unassigned,Journey 2.0
PLD-58,Can a customer come back and resume the journey from where they left off?,Idea Backlog,2025-08-26,209,I need the journey framework to support developing straightforward and personalised journeys,Unassigned,Journey 2.0
PLD-57,"Can we create a single, seamless customer journey for customers purchasing multiple products?",Idea Backlog,2025-09-17,187,I need the journey framework to support developing straightforward and personalised journeys,Unassigned,Journey 2.0
PLD-56,How can we ensure that Models and Questionnaires are compatible?,Idea Design & Solutioning,2026-03-23,0,Quoting,Unassigned,Insurance Product Management
PLD-55,Seamless switching between verticals,Idea Backlog,2025-08-19,216,I need the journey framework to support developing straightforward and personalised journeys,Unassigned,Journey 2.0
PLD-54,Tailor the first question based on a data model,Idea Backlog,2025-08-19,216,I need the journey framework to support developing straightforward and personalised journeys,Unassigned,Journey 2.0
PLD-52,Personalise copy on page rendering,Idea Backlog,2025-08-19,216,I need the journey framework to support developing straightforward and personalised journeys,Unassigned,Journey 2.0
PLD-49,can we inject an interstitial page in between questionnaire questions by adding additional content (interstitial) in Q2Q at realtime,Idea Backlog,2025-08-04,231,I need the journey framework to support developing straightforward and personalised journeys,Unassigned,Journey 2.0
PLD-48,can we inject an interstitial page in between questionnaire questions by breaking Q2Q in half (in realtime) insert a page and resume Q2Q,Idea Backlog,2025-08-04,231,I need the journey framework to support developing straightforward and personalised journeys,Unassigned,Journey 2.0
PLD-47,Can we achieve consisency of sessionization between Amplitude and Looker?,Idea Backlog,2025-08-01,233,I can't track dynamic journeys,Unassigned,Sales Opportunity Framework
PLD-46,Tracking across multiple journeys?,Idea Backlog,2026-02-18,33,I can't track dynamic journeys,Unassigned,Sales Opportunity Framework
PLD-45,How can analysts interpret customer paths through dynamic and multi-product opportunities?,Idea Backlog,2025-08-01,233,I can't track dynamic journeys,Unassigned,Sales Opportunity Framework
PLD-44,What data can we provide to a decision making service for the next step?,Idea Backlog,2025-08-01,233,I can't track dynamic journeys,Unassigned,Sales Opportunity Framework
PLD-42,Can we centralise customer personalisation logic and decision,Idea Backlog,2025-07-25,240,I need the journey framework to support developing straightforward and personalised journeys,Unassigned,Journey 2.0
PLD-41,Can we divert the journey with an interstitial page using customer's realtime interactions and recent events?,Idea Backlog,2025-09-17,187,I need the journey framework to support developing straightforward and personalised journeys,Unassigned,Journey 2.0
PLD-40,Journey Orchestration,Idea Backlog,2025-07-23,243,I need the journey framework to support developing straightforward and personalised journeys,Unassigned,Journey 2.0
PLD-23,Pushing Q2Q journey onto CTM,Idea Backlog,2025-08-18,217,Frontend Vision,Team A+,Frontend Architecture
PLD-22,Add React to pages QCP to Purchase,Idea Backlog,2025-07-14,251,Frontend Vision,Unassigned,Frontend Architecture
PLD-11,Reduce Rater CI time,Idea Backlog,2025-12-11,102,I want a better developer experience,Unassigned,Developer Experience
PLD-9,Platform Investment Case: Coverage diagnosis,Idea Backlog,2025-08-18,217,Frontend Vision,Unassigned,Frontend Architecture
PLD-8,Platform Investment Case: Reactify post-quote pages,Idea Backlog,2025-08-18,217,Frontend Vision,Unassigned,Frontend Architecture
PLD-4,Sales Opportunity Data Framework,Idea Backlog,2025-07-14,251,I can't track dynamic journeys,Unassigned,Sales Opportunity Framework
